<?xml version="1.0" encoding="UTF-8"?>
<clones xmlns:xsi="http://www.w3.org/2001/XMLSchema-instance" xsi:noNamespaceSchemaLocation="XMLSchema.xsd">
  <similarity>0.0</similarity>
  <clone>
    <function>
      <FQN>FQN</FQN>
      <File>File</File>
      <Name>Name</Name>
      <Type>Type</Type>
    </function>
    <From_line>From_line</From_line>
    <To_line>To_line</To_line>
  </clone>
</clones>
